group_name,word,part_of_speech,meaning_en,meaning_th,example,synonyms,antonyms,variations,difficulty,frequency
Environment & Sustainability,Biodiversity,Noun,"The variety of plant and animal life in the world or in a particular habitat.","ความหลากหลายทางชีวภาพ","The rainforest is known for its rich biodiversity.<br>Protecting biodiversity is crucial for a healthy ecosystem.<br>We need to conserve biodiversity for future generations.",biological diversity,-,biodiverse,advanced,high
Environment & Sustainability,Conservation,Noun,"The act of preserving or protecting something from harm or destruction.","การอนุรักษ์","Wildlife conservation is a major global effort.<br>Energy conservation helps reduce our carbon footprint.<br>The government has a strong focus on natural resource conservation.",preservation, protection, safeguarding,destruction, neglect,conserve, conservative,intermediate,high
Environment & Sustainability,Deforestation,Noun,"The action of clearing a wide area of trees.","การตัดไม้ทำลายป่า","Deforestation is a major cause of climate change.<br>The country is fighting against illegal deforestation.<br>We need to stop deforestation to protect animal habitats.",clearing, felling, logging,reforestation, afforestation,deforest, deforested,intermediate,high
Environment & Sustainability,Emission,Noun,"The production and discharge of something, especially gas or radiation.","การปล่อย, ก๊าซเรือนกระจก","The factory's harmful emissions are polluting the air.<br>Countries are working to reduce carbon emissions.<br>Vehicle emission standards have become stricter.",discharge, release, outflow,-,emit, emitted,intermediate,high
Environment & Sustainability,Erosion,Noun,"The process of eroding or being eroded by wind, water, or other natural agents.","การกัดเซาะ","Soil erosion is a serious problem in farming areas.<br>The coastal erosion has damaged many homes.<br>We must find ways to prevent land erosion.",deterioration, wearing away, attrition,formation, buildup,erode, intermediate,high
Environment & Sustainability,Extinct,Adjective,"(of a species, family, or other group of animals or plants) having no living members.","สูญพันธุ์","The dodo bird is an extinct species.<br>We are trying to save several endangered animals from becoming extinct.<br>Many dinosaurs are extinct.",vanished, disappeared, defunct,extant, surviving,extinction, intermediate,high
Environment & Sustainability,Habitat,Noun,"The natural home or environment of an animal, plant, or other organism.","ถิ่นที่อยู่","The polar bear's natural habitat is the Arctic.<br>Deforestation is destroying the habitat of many animals.<br>The park is a protected habitat for many birds.",home, Environment & Sustainability, territory,-,-,intermediate,high
Environment & Sustainability,Pollution,Noun,"The presence in or introduction into the environment of a substance or thing that has harmful or poisonous effects.","มลพิษ","Air and water pollution are major health concerns.<br>The government has implemented new laws to combat pollution.<br>Industrial pollution is a global problem.",contamination, impurity, filth,purification, cleanliness,pollute, polluted,intermediate,high
Environment & Sustainability,Renewable,Adjective,"(of a natural resource or source of energy) not depleted when used.","ที่สามารถนำกลับมาใช้ใหม่ได้","Solar and wind power are forms of renewable energy.<br>The country is investing heavily in renewable resources.<br>Using renewable materials is good for the planet.",sustainable, replenishable, inexhaustible,non-renewable, exhaustible,renew, renewal,intermediate,high
Environment & Sustainability,Sustainable,Adjective,"Able to be maintained at a certain rate or level.","ที่ยั่งยืน","The company is committed to sustainable development.<br>We need to find sustainable solutions to our problems.<br>Sustainable agriculture is key for the future.",viable, enduring, lasting,unsustainable, temporary,sustainability, intermediate,high
Environment & Sustainability,Biodegradable,Adjective,"(of a substance or object) capable of being decomposed by bacteria or other living organisms.","ที่ย่อยสลายได้ทางชีวภาพ","We should use biodegradable bags instead of plastic ones.<br>The material is completely biodegradable.<br>Biodegradable waste can be used for compost.",compostable, decomposable,-,non-biodegradable,biodegradability, advanced,medium
Environment & Sustainability,Carbon footprint,Phrase,"The amount of carbon dioxide released into the atmosphere as a result of the activities of a particular individual, organization, or community.","ปริมาณคาร์บอนฟุตพรินท์","You can reduce your carbon footprint by walking or cycling.<br>The company is trying to reduce its carbon footprint.<br>Flying has a large carbon footprint.",CO2 emissions,-,-,carbon, intermediate,high
Environment & Sustainability,Climate change,Phrase,"A change in global or regional climate patterns.","การเปลี่ยนแปลงสภาพภูมิอากาศ","Climate change is the most significant challenge of our time.<br>We need to take action to mitigate climate change.<br>The effects of climate change are visible everywhere.",global warming, climate shift,-,-,intermediate,high
Environment & Sustainability,Ecological,Adjective,"Relating to or concerned with the relation of living organisms to one another and to their physical surroundings.","เกี่ยวกับนิเวศวิทยา","The new policy aims to protect the ecological balance of the forest.<br>He has a strong interest in ecological issues.<br>We need to find an ecological solution to the problem.",environmental, biological, symbiotic,-,ecology, ecologist,intermediate,high
Environment & Sustainability,Ecosystem,Noun,"A biological community of interacting organisms and their physical environment.","ระบบนิเวศ","The coral reef is a delicate ecosystem.<br>We need to protect the fragile rainforest ecosystem.<br>The pollution has damaged the entire lake ecosystem.",Environment & Sustainability, habitat, biome,-,-,intermediate,high
Environment & Sustainability,Fossil fuels,Phrase,"A natural fuel such as coal or gas, formed in the geological past from the remains of living organisms.","เชื้อเพลิงฟอสซิล","Burning fossil fuels releases a lot of carbon dioxide.<br>We need to move away from fossil fuels to renewable energy.<br>Coal and oil are common fossil fuels.",non-renewable energy,-,-,-,intermediate,high
Environment & Sustainability,Greenhouse effect,Phrase,"The trapping of the sun's warmth in a planet's lower atmosphere.","ปรากฏการณ์เรือนกระจก","The greenhouse effect is causing the planet to warm up.<br>Gases from factories contribute to the greenhouse effect.<br>The greenhouse effect is a natural process that has been accelerated by human activity.",global warming,-,-,-,intermediate,high
Environment & Sustainability,Mitigation,Noun,"The action of reducing the severity, seriousness, or painfulness of something.","การบรรเทา","We need to focus on climate change mitigation.<br>The government is providing funds for flood mitigation.<br>Mitigation strategies are essential for disaster management.",alleviation, reduction, lessening,aggravation, intensification,mitigate, intermediate,high
Environment & Sustainability,Reforestation,Noun,"The replanting of forests.","การปลูกป่า","The organization is working on a massive reforestation project.<br>Reforestation is one of the best ways to combat climate change.<br>The government is offering incentives for reforestation.",replanting, afforestation, forestation,deforestation, intermediate,medium
Environment & Sustainability,Waste management,Phrase,"The collection, transport, and disposal of garbage.","การจัดการขยะ","Effective waste management is crucial for a clean city.<br>The company has a new waste management system.<br>Proper waste management helps protect the environment.",refuse disposal, garbage control,-,-,intermediate,high
Environment & Sustainability,Adaptation,Noun,"The process of adjusting to new conditions.","การปรับตัว","We need a strategy for climate change adaptation.<br>The animal's adaptation to its environment is remarkable.<br>The community's adaptation to the new policy was difficult.",adjustment, acclimation, modification,rigidity, inflexibility,adapt, intermediate,high
Environment & Sustainability,Atmosphere,Noun,"The envelope of gases surrounding the earth or another planet.","บรรยากาศ","The atmosphere protects the Earth from harmful radiation.<br>Pollution is changing the composition of the atmosphere.<br>The moon has no atmosphere.",air, gas envelope, sky,-,atmospheric, intermediate,high
Environment & Sustainability,Biosphere,Noun,"The part of the earth's crust, waters, and atmosphere that supports life.","ชีวาลัย","The biosphere is home to all living things.<br>Pollution can have a devastating effect on the biosphere.<br>We are all connected within the biosphere.",global ecosystem,-,-,advanced,low
Environment & Sustainability,Ecology,Noun,"The branch of biology that deals with the relations of organisms to one another and to their physical surroundings.","นิเวศวิทยา","He is studying the ecology of the Amazon rainforest.<br>The course covers basic principles of ecology.<br>She is a professor of human ecology.",environmental biology,-,ecological, ecologist,advanced,medium
Environment & Sustainability,Ecosystem,Noun,"A biological community of interacting organisms and their physical environment.","ระบบนิเวศ","The coral reef is a delicate ecosystem.<br>We need to protect the fragile rainforest ecosystem.<br>The pollution has damaged the entire lake ecosystem.",Environment & Sustainability, habitat, biome,-,-,intermediate,high
Environment & Sustainability,Environmentalist,Noun,"A person who is concerned with or advocates for the protection of the environment.","นักสิ่งแวดล้อม","She is a dedicated environmentalist.<br>The protest was organized by local environmentalists.<br>He has been a strong environmentalist for years.",conservationist, ecologist, preservationist,-,environmentalism, intermediate,high
Environment & Sustainability,Fauna,Noun,"The animals of a particular region, habitat, or geological period.","สัตว์ที่อาศัยอยู่ในพื้นที่หนึ่ง","The fauna of the island is unique and diverse.<br>The report focused on the flora and fauna of the park.<br>The new law protects the native fauna.",animal life, wildlife,-,flora, advanced,low
Environment & Sustainability,Flora,Noun,"The plants of a particular region, habitat, or geological period.","พืชในพื้นที่หนึ่ง","The flora of the Amazon rainforest is incredibly diverse.<br>The book describes the flora and fauna of the region.<br>He is an expert on the local flora.",plant life, vegetation,-,fauna, advanced,low
Environment & Sustainability,Geothermal,Adjective,"Relating to or produced by the internal heat of the earth.","ที่เกี่ยวกับความร้อนใต้พิภพ","Geothermal energy is a clean and renewable power source.<br>The country is a leader in geothermal power.<br>They are building a new geothermal plant.",volcanic, thermal,-,-,advanced,low
Environment & Sustainability,Glacier,Noun,"A slowly moving mass or river of ice formed by the accumulation and compaction of snow on mountains or near the poles.","ธารน้ำแข็ง","Glaciers are melting rapidly due to global warming.<br>The expedition explored the ancient glacier.<br>The glacier's retreat is a sign of climate change.",ice sheet, ice mass,-,-,intermediate,high
Environment & Sustainability,Hazardous,Adjective,"Risky; dangerous.","ที่เป็นอันตราย","Hazardous waste must be disposed of properly.<br>The factory was cited for hazardous working conditions.<br>He works with hazardous chemicals.",dangerous, risky, perilous,safe, harmless,hazard, intermediate,high
Environment & Sustainability,Hydrosphere,Noun,"All the waters on the earth's surface, such as lakes and seas, and sometimes including water over the earth's surface, such as clouds.","อุทกภาค, ส่วนที่เป็นน้ำบนโลก","The hydrosphere is vital for sustaining life on Earth.<br>Pollution of the hydrosphere is a major issue.<br>The study focuses on the interaction between the hydrosphere and the atmosphere.",aquatic Environment & Sustainability,-,-,advanced,low
Environment & Sustainability,Incineration,Noun,"The destruction of something, especially waste material, by burning.","การเผา","Incineration is one way to dispose of waste.<br>The city is building a new waste incineration plant.<br>Incineration can produce energy, but it also creates pollution.",burning, combustion, destruction,-,incinerate, incinerator,advanced,low
Environment & Sustainability,Landfill,Noun,"A large hole in the ground where rubbish is buried.","ที่ฝังกลบขยะ","The city's landfill is almost full.<br>We need to reduce the amount of waste that goes to landfill.<br>Landfills can produce methane gas.",dump, waste site, garbage pit,-,-,intermediate,high
Environment & Sustainability,Lithosphere,Noun,"The rigid outer part of the earth, consisting of the crust and upper mantle.","ธรณีภาค, เปลือกโลก","The lithosphere is where we live and grow our food.<br>Plate tectonics is a process that affects the lithosphere.<br>The study focuses on the structure of the lithosphere.",earth's crust,-,-,advanced,low
Environment & Sustainability,Mitigate,Verb,"To make something less severe or painful.","บรรเทา","We need to mitigate the effects of climate change.<br>The new policy aims to mitigate the risk of flooding.<br>His role is to mitigate the conflict between the two parties.",alleviate, lessen, reduce,aggravate, intensify,mitigation, advanced,high
Environment & Sustainability,Non-renewable,Adjective,"(of a natural resource or source of energy) existing in finite quantity; not capable of being replenished.","ที่ไม่สามารถนำกลับมาใช้ใหม่ได้","Fossil fuels are a major non-renewable resource.<br>We are using up our non-renewable resources too quickly.<br>The country is dependent on non-renewable energy.",exhaustible, finite,-,renewable, replenishable,non-renewal, intermediate,high
Environment & Sustainability,Ozone layer,Phrase,"A layer in the Earth's stratosphere at an altitude of about 10 km (6 miles) containing a high concentration of ozone.","ชั้นโอโซน","The ozone layer protects us from the sun's harmful UV radiation.<br>Scientists are concerned about the depletion of the ozone layer.<br>The use of certain chemicals has damaged the ozone layer.",ozone shield,-,-,-,intermediate,high
Environment & Sustainability,Permafrost,Noun,"A thick subsurface layer of soil that remains frozen throughout the year.","ชั้นดินเยือกแข็งคงตัว","The melting of permafrost is releasing methane gas.<br>The construction was difficult due to the permafrost.<br>Permafrost is found in the Arctic regions.",permanently frozen ground,-,-,-,advanced,low
Environment & Sustainability,Pristine,Adjective,"In its original condition; unspoiled.","บริสุทธิ์, ดั้งเดิม","The lake is known for its pristine waters.<br>The remote island has a pristine beach.<br>We must protect this pristine environment.",unspoiled, untouched, pure,polluted, spoiled,pristinely, advanced,medium
Environment & Sustainability,Recycle,Verb,"To convert (waste) into reusable material.","รีไซเคิล","You can recycle plastic bottles and glass jars.<br>The city has a program to encourage people to recycle.<br>We need to recycle more to reduce landfill waste.",reprocess, reuse, salvage,throw away,-,recycling, recycled,intermediate,high
Environment & Sustainability,Reforestation,Noun,"The replanting of forests.","การปลูกป่า","The organization is working on a massive reforestation project.<br>Reforestation is one of the best ways to combat climate change.<br>The government is offering incentives for reforestation.",replanting, afforestation, forestation,deforestation, intermediate,medium
Environment & Sustainability,Resilience,Noun,"The capacity to recover quickly from difficulties; toughness.","ความยืดหยุ่น, การฟื้นตัว","The ecosystem has a high degree of resilience.<br>The community showed great resilience after the storm.<br>His resilience is admirable.",flexibility, durability, strength,fragility, weakness,resilient, advanced,high
Environment & Sustainability,Smog,Noun,"A kind of air pollution caused by a mixture of smoke and fog.","หมอกควันพิษ","The city is often covered in thick smog.<br>Smog is a major health problem in urban areas.<br>The factory contributes to the smog in the region.",haze, pollution, atmospheric pollution,-,-,intermediate,high
Environment & Sustainability,Solar power,Phrase,"Power obtained by harnessing the energy of the sun's rays.","พลังงานแสงอาทิตย์","More homes are using solar power to generate electricity.<br>Solar power is a clean and renewable energy source.<br>The government is offering subsidies for solar power installation.",solar energy,-,-,-,intermediate,high
Environment & Sustainability,Sustainable development,Phrase,"Economic development that is conducted without depletion of natural resources.","การพัฒนาที่ยั่งยืน","Sustainable development is the goal of many international organizations.<br>The new project is based on the principles of sustainable development.<br>We must balance economic growth with sustainable development.",eco-friendly development, green development,-,-,advanced,high
Environment & Sustainability,Toxic,Adjective,"Poisonous.","เป็นพิษ","The factory released toxic chemicals into the river.<br>The waste is highly toxic and dangerous.<br>You need to handle these toxic substances with care.",poisonous, venomous, harmful,non-toxic, harmless,toxicity, intermediate,high
Environment & Sustainability,Vulnerable,Adjective,"Exposed to the possibility of being attacked or harmed, either physically or emotionally.","เปราะบาง, เสี่ยง","Endangered species are highly vulnerable to habitat loss.<br>The coast is vulnerable to erosion.<br>Children are often the most vulnerable members of society.",susceptible, defenseless, exposed,invulnerable, protected,vulnerability, intermediate,high
Environment & Sustainability,Waste management,Phrase,"The collection, transport, and disposal of garbage.","การจัดการขยะ","Effective waste management is crucial for a clean city.<br>The company has a new waste management system.<br>Proper waste management helps protect the environment.",refuse disposal, garbage control,-,-,intermediate,high
Environment & Sustainability,Wind power,Phrase,"Power generated by converting the force of the wind into energy.","พลังงานลม","Wind power is a clean alternative to fossil fuels.<br>The country has many wind power farms.<br>Wind power is becoming more efficient.",wind energy,-,-,-,intermediate,high
Environment & Sustainability,Zoning,Noun,"The practice of dividing a city or other area into sections reserved for different purposes.","การแบ่งเขตการใช้ที่ดิน","The city's new zoning laws protect green spaces.<br>The area is zoned for residential use only.<br>Zoning can help with environmental protection.",planning, land-use planning, regulation,-,zone, zoned,advanced,low
Environment & Sustainability,Abatement,Noun,"The action of lessening or reducing something.","การลดลง","The government is working on noise and pollution abatement.<br>The company's new technology allows for pollution abatement.<br>He is in charge of a project for environmental abatement.",reduction, decrease, lessening,increase, growth,abate, advanced,low
Environment & Sustainability,Acid rain,Phrase,"Rain that is unusually acidic due to atmospheric pollutants.","ฝนกรด","Acid rain can damage forests and lakes.<br>The factory's emissions are contributing to acid rain.<br>Acid rain is a consequence of air pollution.",atmospheric deposition,-,-,acidic, intermediate,high
Environment & Sustainability,Aerosol,Noun,"A substance enclosed under pressure and able to be released as a fine spray.","ละอองลอย","Aerosol cans can release harmful chemicals into the atmosphere.<br>The product comes in an aerosol spray.<br>We need to reduce the use of aerosols to protect the ozone layer.",spray, mist, vapor,-,-,intermediate,low
Environment & Sustainability,Afforestation,Noun,"The action of planting trees in an area that was not previously a forest.","การปลูกป่าในพื้นที่ที่ไม่เคยเป็นป่า","The government is promoting afforestation to combat desertification.<br>Afforestation is a long-term solution to land degradation.<br>The project aims for large-scale afforestation.",forest planting, tree planting,-,deforestation, intermediate,medium
Environment & Sustainability,Aquaculture,Noun,"The rearing of aquatic animals or the cultivation of aquatic plants for food.","การเพาะเลี้ยงสัตว์น้ำ","Aquaculture is a growing industry that provides a source of protein.<br>He is a researcher in the field of aquaculture.<br>Sustainable aquaculture practices are important.",fish farming, water farming,-,-,advanced,low
Environment & Sustainability,Aquifer,Noun,"A body of permeable rock which can contain or transmit groundwater.","ชั้นหินอุ้มน้ำ","The city's water supply comes from a large aquifer.<br>The pollution has contaminated the local aquifer.<br>We need to protect our aquifers from overuse.",groundwater basin, water table,-,-,advanced,low
Environment & Sustainability,Arid,Adjective,"Having little or no rain.","แห้งแล้ง","The arid climate makes farming very difficult.<br>The plant is well-suited for arid conditions.<br>The region is becoming increasingly arid.",dry, parched, desiccated,wet, humid,aridity, advanced,medium
Environment & Sustainability,Atmospheric,Adjective,"Relating to the atmosphere.","เกี่ยวกับบรรยากาศ","The atmospheric pressure is very low today.<br>The study is on atmospheric changes.<br>Atmospheric pollution is a major concern.",aerial, gaseous, ambient,-,atmosphere, intermediate,high
Environment & Sustainability,Biofuel,Noun,"A fuel derived directly from living matter.","เชื้อเพลิงชีวภาพ","Biofuels are considered a renewable alternative to fossil fuels.<br>The car runs on biofuel.<br>The company is investing in biofuel production.",biomass fuel, renewable fuel,-,-,intermediate,medium
Environment & Sustainability,Biomass,Noun,"Organic matter used as a fuel, especially in a power station for the generation of electricity.","ชีวมวล","The power plant generates electricity from biomass.<br>Biomass is a renewable source of energy.<br>The use of biomass can reduce carbon emissions.",organic fuel, biological material,-,-,advanced,low
Environment & Sustainability,Biosphere,Noun,"The part of the earth's crust, waters, and atmosphere that supports life.","ชีวาลัย","The biosphere is home to all living things.<br>Pollution can have a devastating effect on the biosphere.<br>We are all connected within the biosphere.",global ecosystem,-,-,advanced,low
Environment & Sustainability,Carbon capture,Phrase,"The process of trapping carbon dioxide and storing it so it cannot enter the atmosphere.","การดักจับและกักเก็บคาร์บอน","Carbon capture technology is essential for mitigating climate change.<br>The new plant will use carbon capture to reduce its emissions.<br>Carbon capture is still a developing technology.",carbon sequestration,-,-,-,advanced,medium
Environment & Sustainability,Climate,Noun,"The weather conditions prevailing in an area in general or over a long period.","ภูมิอากาศ","The climate of this region is very cold in winter.<br>Climate change is a long-term shift in global weather patterns.<br>The project aims to study the local climate.",weather pattern, atmosphere, Environment & Sustainability,-,climatic, intermediate,high
Environment & Sustainability,Contaminate,Verb,"To make something impure or unsuitable by contact with something unclean or poisonous.","ปนเปื้อน","The chemicals contaminated the local water supply.<br>The soil was contaminated with heavy metals.<br>Do not contaminate the clean water.",pollute, taint, spoil,purify, clean,contamination, contaminated,intermediate,high
