group_name,word,part_of_speech,meaning_en,meaning_th,example,synonyms,antonyms,variations,difficulty,frequency
Environment & Sustainability,Fossil fuels,Phrase,"A natural fuel such as coal or gas, formed in the geological past from the remains of living organisms.","เชื้อเพลิงฟอสซิล","Burning fossil fuels releases a lot of carbon dioxide.<br>We need to move away from fossil fuels to renewable energy.<br>Coal and oil are common fossil fuels.",non-renewable energy,-,-,-,intermediate,high
Environment & Sustainability,Greenhouse effect,Phrase,"The trapping of the sun's warmth in a planet's lower atmosphere.","ปรากฏการณ์เรือนกระจก","The greenhouse effect is causing the planet to warm up.<br>Gases from factories contribute to the greenhouse effect.<br>The greenhouse effect is a natural process that has been accelerated by human activity.",global warming,-,-,-,intermediate,high
Environment & Sustainability,Mitigation,Noun,"The action of reducing the severity, seriousness, or painfulness of something.","การบรรเทา","We need to focus on climate change mitigation.<br>The government is providing funds for flood mitigation.<br>Mitigation strategies are essential for disaster management.",alleviation, reduction, lessening,aggravation, intensification,mitigate, intermediate,high
Environment & Sustainability,Reforestation,Noun,"The replanting of forests.","การปลูกป่า","The organization is working on a massive reforestation project.<br>Reforestation is one of the best ways to combat climate change.<br>The government is offering incentives for reforestation.",replanting, afforestation, forestation,deforestation, intermediate,medium
Environment & Sustainability,Waste management,Phrase,"The collection, transport, and disposal of garbage.","การจัดการขยะ","Effective waste management is crucial for a clean city.<br>The company has a new waste management system.<br>Proper waste management helps protect the environment.",refuse disposal, garbage control,-,-,intermediate,high
Environment & Sustainability,Adaptation,Noun,"The process of adjusting to new conditions.","การปรับตัว","We need a strategy for climate change adaptation.<br>The animal's adaptation to its environment is remarkable.<br>The community's adaptation to the new policy was difficult.",adjustment, acclimation, modification,rigidity, inflexibility,adapt, intermediate,high
Environment & Sustainability,Atmosphere,Noun,"The envelope of gases surrounding the earth or another planet.","บรรยากาศ","The atmosphere protects the Earth from harmful radiation.<br>Pollution is changing the composition of the atmosphere.<br>The moon has no atmosphere.",air, gas envelope, sky,-,atmospheric, intermediate,high
Environment & Sustainability,Biosphere,Noun,"The part of the earth's crust, waters, and atmosphere that supports life.","ชีวาลัย","The biosphere is home to all living things.<br>Pollution can have a devastating effect on the biosphere.<br>We are all connected within the biosphere.",global ecosystem,-,-,advanced,low
Environment & Sustainability,Ecology,Noun,"The branch of biology that deals with the relations of organisms to one another and to their physical surroundings.","นิเวศวิทยา","He is studying the ecology of the Amazon rainforest.<br>The course covers basic principles of ecology.<br>She is a professor of human ecology.",environmental biology,-,ecological, ecologist,advanced,medium
Environment & Sustainability,Environmentalist,Noun,"A person who is concerned with or advocates for the protection of the environment.","นักสิ่งแวดล้อม","She is a dedicated environmentalist.<br>The protest was organized by local environmentalists.<br>He has been a strong environmentalist for years.",conservationist, ecologist, preservationist,-,environmentalism, intermediate,high
Environment & Sustainability,Fauna,Noun,"The animals of a particular region, habitat, or geological period.","สัตว์ที่อาศัยอยู่ในพื้นที่หนึ่ง","The fauna of the island is unique and diverse.<br>The report focused on the flora and fauna of the park.<br>The new law protects the native fauna.",animal life, wildlife,-,flora, advanced,low
Environment & Sustainability,Flora,Noun,"The plants of a particular region, habitat, or geological period.","พืชในพื้นที่หนึ่ง","The flora of the Amazon rainforest is incredibly diverse.<br>The book describes the flora and fauna of the region.<br>He is an expert on the local flora.",plant life, vegetation,-,fauna, advanced,low
Environment & Sustainability,Geothermal,Adjective,"Relating to or produced by the internal heat of the earth.","ที่เกี่ยวกับความร้อนใต้พิภพ","Geothermal energy is a clean and renewable power source.<br>The country is a leader in geothermal power.<br>They are building a new geothermal plant.",volcanic, thermal,-,-,advanced,low
Environment & Sustainability,Glacier,Noun,"A slowly moving mass or river of ice formed by the accumulation and compaction of snow on mountains or near the poles.","ธารน้ำแข็ง","Glaciers are melting rapidly due to global warming.<br>The expedition explored the ancient glacier.<br>The glacier's retreat is a sign of climate change.",ice sheet, ice mass,-,-,intermediate,high
Environment & Sustainability,Hazardous,Adjective,"Risky; dangerous.","ที่เป็นอันตราย","Hazardous waste must be disposed of properly.<br>The factory was cited for hazardous working conditions.<br>He works with hazardous chemicals.",dangerous, risky, perilous,safe, harmless,hazard, intermediate,high
Environment & Sustainability,Hydrosphere,Noun,"All the waters on the earth's surface, such as lakes and seas, and sometimes including water over the earth's surface, such as clouds.","อุทกภาค, ส่วนที่เป็นน้ำบนโลก","The hydrosphere is vital for sustaining life on Earth.<br>Pollution of the hydrosphere is a major issue.<br>The study focuses on the interaction between the hydrosphere and the atmosphere.",aquatic Environment & Sustainability,-,-,advanced,low
Environment & Sustainability,Incineration,Noun,"The destruction of something, especially waste material, by burning.","การเผา","Incineration is one way to dispose of waste.<br>The city is building a new waste incineration plant.<br>Incineration can produce energy, but it also creates pollution.",burning, combustion, destruction,-,incinerate, incinerator,advanced,low
Environment & Sustainability,Landfill,Noun,"A large hole in the ground where rubbish is buried.","ที่ฝังกลบขยะ","The city's landfill is almost full.<br>We need to reduce the amount of waste that goes to landfill.<br>Landfills can produce methane gas.",dump, waste site, garbage pit,-,-,intermediate,high
Environment & Sustainability,Lithosphere,Noun,"The rigid outer part of the earth, consisting of the crust and upper mantle.","ธรณีภาค, เปลือกโลก","The lithosphere is where we live and grow our food.<br>Plate tectonics is a process that affects the lithosphere.<br>The study focuses on the structure of the lithosphere.",earth's crust,-,-,advanced,low
Environment & Sustainability,Mitigate,Verb,"To make something less severe or painful.","บรรเทา","We need to mitigate the effects of climate change.<br>The new policy aims to mitigate the risk of flooding.<br>His role is to mitigate the conflict between the two parties.",alleviate, lessen, reduce,aggravate, intensify,mitigation, advanced,high
Environment & Sustainability,Non-renewable,Adjective,"(of a natural resource or source of energy) existing in finite quantity; not capable of being replenished.","ที่ไม่สามารถนำกลับมาใช้ใหม่ได้","Fossil fuels are a major non-renewable resource.<br>We are using up our non-renewable resources too quickly.<br>The country is dependent on non-renewable energy.",exhaustible, finite,-,renewable, replenishable,non-renewal, intermediate,high
Environment & Sustainability,Ozone layer,Phrase,"A layer in the Earth's stratosphere at an altitude of about 10 km (6 miles) containing a high concentration of ozone.","ชั้นโอโซน","The ozone layer protects us from the sun's harmful UV radiation.<br>Scientists are concerned about the depletion of the ozone layer.<br>The use of certain chemicals has damaged the ozone layer.",ozone shield,-,-,-,intermediate,high
Environment & Sustainability,Permafrost,Noun,"A thick subsurface layer of soil that remains frozen throughout the year.","ชั้นดินเยือกแข็งคงตัว","The melting of permafrost is releasing methane gas.<br>The construction was difficult due to the permafrost.<br>Permafrost is found in the Arctic regions.",permanently frozen ground,-,-,-,advanced,low
Environment & Sustainability,Pristine,Adjective,"In its original condition; unspoiled.","บริสุทธิ์, ดั้งเดิม","The lake is known for its pristine waters.<br>The remote island has a pristine beach.<br>We must protect this pristine environment.",unspoiled, untouched, pure,polluted, spoiled,pristinely, advanced,medium
Environment & Sustainability,Recycle,Verb,"To convert (waste) into reusable material.","รีไซเคิล","You can recycle plastic bottles and glass jars.<br>The city has a program to encourage people to recycle.<br>We need to recycle more to reduce landfill waste.",reprocess, reuse, salvage,throw away,-,recycling, recycled,intermediate,high
Environment & Sustainability,Reforestation,Noun,"The replanting of forests.","การปลูกป่า","The organization is working on a massive reforestation project.<br>Reforestation is one of the best ways to combat climate change.<br>The government is offering incentives for reforestation.",replanting, afforestation, forestation,deforestation, intermediate,medium
Environment & Sustainability,Resilience,Noun,"The capacity to recover quickly from difficulties; toughness.","ความยืดหยุ่น, การฟื้นตัว","The ecosystem has a high degree of resilience.<br>The community showed great resilience after the storm.<br>His resilience is admirable.",flexibility, durability, strength,fragility, weakness,resilient, advanced,high
Environment & Sustainability,Smog,Noun,"A kind of air pollution caused by a mixture of smoke and fog.","หมอกควันพิษ","The city is often covered in thick smog.<br>Smog is a major health problem in urban areas.<br>The factory contributes to the smog in the region.",haze, pollution, atmospheric pollution,-,-,intermediate,high
Environment & Sustainability,Solar power,Phrase,"Power obtained by harnessing the energy of the sun's rays.","พลังงานแสงอาทิตย์","More homes are using solar power to generate electricity.<br>Solar power is a clean and renewable energy source.<br>The government is offering subsidies for solar power installation.",solar energy,-,-,-,intermediate,high
Environment & Sustainability,Sustainable development,Phrase,"Economic development that is conducted without depletion of natural resources.","การพัฒนาที่ยั่งยืน","Sustainable development is the goal of many international organizations.<br>The new project is based on the principles of sustainable development.<br>We must balance economic growth with sustainable development.",eco-friendly development, green development,-,-,advanced,high
Environment & Sustainability,Toxic,Adjective,"Poisonous.","เป็นพิษ","The factory released toxic chemicals into the river.<br>The waste is highly toxic and dangerous.<br>You need to handle these toxic substances with care.",poisonous, venomous, harmful,non-toxic, harmless,toxicity, intermediate,high
Environment & Sustainability,Vulnerable,Adjective,"Exposed to the possibility of being attacked or harmed, either physically or emotionally.","เปราะบาง, เสี่ยง","Endangered species are highly vulnerable to habitat loss.<br>The coast is vulnerable to erosion.<br>Children are often the most vulnerable members of society.",susceptible, defenseless, exposed,invulnerable, protected,vulnerability, intermediate,high
Environment & Sustainability,Waste management,Phrase,"The collection, transport, and disposal of garbage.","การจัดการขยะ","Effective waste management is crucial for a clean city.<br>The company has a new waste management system.<br>Proper waste management helps protect the environment.",refuse disposal, garbage control,-,-,intermediate,high
Environment & Sustainability,Wind power,Phrase,"Power generated by converting the force of the wind into energy.","พลังงานลม","Wind power is a clean alternative to fossil fuels.<br>The country has many wind power farms.<br>Wind power is becoming more efficient.",wind energy,-,-,-,intermediate,high
Environment & Sustainability,Zoning,Noun,"The practice of dividing a city or other area into sections reserved for different purposes.","การแบ่งเขตการใช้ที่ดิน","The city's new zoning laws protect green spaces.<br>The area is zoned for residential use only.<br>Zoning can help with environmental protection.",planning, land-use planning, regulation,-,zone, zoned,advanced,low
