group_name,word,part_of_speech,meaning_en,meaning_th,example,synonyms,antonyms,variations,difficulty,frequency
Environment & Sustainability,Incineration,Noun,"The destruction of something, especially waste material, by burning.","การเผา","Incineration is one way to dispose of waste.<br>The city is building a new waste incineration plant.<br>Incineration can produce energy, but it also creates pollution.",burning, combustion, destruction,-,incinerate, incinerator,advanced,low
Environment & Sustainability,Invasive species,Phrase,"A species that is not native to a specific location and has a tendency to spread to a degree believed to cause damage to the environment.","ชนิดพันธุ์รุกราน","The introduction of invasive species can harm the local ecosystem.<br>The new law aims to control invasive species.<br>Invasive species can outcompete native plants.",alien species, introduced species,-,-,advanced,medium
Environment & Sustainability,Landfill,Noun,"A large hole in the ground where rubbish is buried.","ที่ฝังกลบขยะ","The city's landfill is almost full.<br>We need to reduce the amount of waste that goes to landfill.<br>Landfills can produce methane gas.",dump, waste site, garbage pit,-,-,intermediate,high
Environment & Sustainability,Mitigation,Noun,"The action of lessening or reducing something.","การบรรเทา","We need to focus on climate change mitigation.<br>The government is providing funds for flood mitigation.<br>Mitigation strategies are essential for disaster management.",alleviation, reduction, lessening,aggravation, intensification,mitigate, intermediate,high
Environment & Sustainability,Ozone,Noun,"A colorless unstable toxic gas with a pungent smell and powerful oxidizing properties.","โอโซน","The ozone layer protects the Earth from harmful radiation.<br>Ground-level ozone is a major air pollutant.<br>The chemical reaction produced ozone.",O3,-,-,advanced,low
Environment & Sustainability,Photosynthesis,Noun,"The process by which green plants and some other organisms use sunlight to synthesize foods from carbon dioxide and water.","การสังเคราะห์แสง","Photosynthesis is a vital process for all life on Earth.<br>The plant uses photosynthesis to create its own food.<br>The lab experiment demonstrated photosynthesis.",carbon assimilation,-,photosynthetic, advanced,low
Environment & Sustainability,Pollution,Noun,"The presence in or introduction into the environment of a substance or thing that has harmful or poisonous effects.","มลพิษ","Air and water pollution are major health concerns.<br>The government has implemented new laws to combat pollution.<br>Industrial pollution is a global problem.",contamination, impurity, filth,purification, cleanliness,pollute, polluted,intermediate,high
Environment & Sustainability,Precipitation,Noun,"Rain, snow, sleet, or hail that falls to the ground.","หยาดน้ำฟ้า","The region receives very little precipitation.<br>The forecast calls for a high amount of precipitation.<br>The drought was caused by a lack of precipitation.",rainfall, rain, moisture,-,precipitate, advanced,high
Environment & Sustainability,Recycling,Noun,"The action or process of converting waste into reusable material.","การรีไซเคิล","The city has a new recycling program.<br>Recycling helps reduce waste and conserve resources.<br>The company is committed to recycling all its waste.",reprocessing, reuse, salvaging,-,recycle, recycled,intermediate,high
Environment & Sustainability,Rehabilitation,Noun,"The action of restoring something to its former condition.","การฟื้นฟู","The project focuses on the rehabilitation of the degraded ecosystem.<br>He is in a rehabilitation center.<br>The program is for the rehabilitation of drug addicts.",restoration, reclamation, revival,destruction, deterioration,rehabilitate, advanced,high
Environment & Sustainability,Reforestation,Noun,"The replanting of forests.","การปลูกป่า","The organization is working on a massive reforestation project.<br>Reforestation is one of the best ways to combat climate change.<br>The government is offering incentives for reforestation.",replanting, afforestation, forestation,deforestation, intermediate,medium
Environment & Sustainability,Renewable,Adjective,"(of a natural resource or source of energy) not depleted when used.","ที่สามารถนำกลับมาใช้ใหม่ได้","Solar and wind power are forms of renewable energy.<br>The country is investing heavily in renewable resources.<br>Using renewable materials is good for the planet.",sustainable, replenishable, inexhaustible,non-renewable, exhaustible,renew, renewal,intermediate,high
Environment & Sustainability,Sanitation,Noun,"Conditions relating to public health, especially the provision of clean drinking water and adequate sewage disposal.","สุขาภิบาล","Poor sanitation is a major cause of disease.<br>The city has improved its sanitation system.<br>The report highlights the need for better sanitation.",hygiene, cleanliness, waste disposal,-,sanitary, intermediate,high
Environment & Sustainability,Sustainability,Noun,"The ability to be maintained at a certain rate or level.","ความยั่งยืน","The company's goal is to achieve long-term sustainability.<br>Sustainability is a core value of the organization.<br>The report discusses the sustainability of the new policy.",viability, endurance, permanence,unsustainability, temporary,sustainable, advanced,high
Environment & Sustainability,Terrestrial,Adjective,"Relating to the earth.","เกี่ยวกับโลก, บนบก","The study focuses on terrestrial ecosystems.<br>The animal is a terrestrial species.<br>Humans are terrestrial beings.",earthly, land-based,-,aquatic, marine,terrestrially, advanced,low
Environment & Sustainability,Toxin,Noun,"A poisonous substance produced by living cells or organisms.","สารพิษ","The fish in the river contained high levels of toxins.<br>The plant produces a potent toxin.<br>We need to remove the toxins from the water.",poison, venom, pollutant,antidote, antitoxin,toxic, intermediate,high
Environment & Sustainability,Vulnerable,Adjective,"Exposed to the possibility of being attacked or harmed, either physically or emotionally.","เปราะบาง, เสี่ยง","Endangered species are highly vulnerable to habitat loss.<br>The coast is vulnerable to erosion.<br>Children are often the most vulnerable members of society.",susceptible, defenseless, exposed,invulnerable, protected,vulnerability, intermediate,high
Environment & Sustainability,Watershed,Noun,"An area or ridge of land that separates waters flowing to different rivers, basins, or seas.","พื้นที่ลุ่มน้ำ","The new law protects the entire watershed.<br>The pollution in the river affects the entire watershed.<br>The project focuses on managing the local watershed.",drainage basin, catchment, water basin,-,-,advanced,low
Environment & Sustainability,Wind farm,Phrase,"An area of land with a group of wind turbines.","ฟาร์มกังหันลม","The company is building a new wind farm.<br>Wind farms are a source of clean energy.<br>The wind farm generates electricity for the whole town.",wind park, wind power station,-,-,intermediate,low
Environment & Sustainability,Acid rain,Phrase,"Rain that is unusually acidic due to atmospheric pollutants.","ฝนกรด","Acid rain can damage forests and lakes.<br>The factory's emissions are contributing to acid rain.<br>Acid rain is a consequence of air pollution.",atmospheric deposition,-,-,acidic, intermediate,high
Environment & Sustainability,Biodegradable,Adjective,"(of a substance or object) capable of being decomposed by bacteria or other living organisms.","ที่ย่อยสลายได้ทางชีวภาพ","We should use biodegradable bags instead of plastic ones.<br>The material is completely biodegradable.<br>Biodegradable waste can be used for compost.",compostable, decomposable,-,non-biodegradable,biodegradability, advanced,medium
Environment & Sustainability,Carbon footprint,Phrase,"The amount of carbon dioxide released into the atmosphere as a result of the activities of a particular individual, organization, or community.","ปริมาณคาร์บอนฟุตพรินท์","You can reduce your carbon footprint by walking or cycling.<br>The company is trying to reduce its carbon footprint.<br>Flying has a large carbon footprint.",CO2 emissions,-,-,carbon, intermediate,high
Environment & Sustainability,Climate change,Phrase,"A change in global or regional climate patterns.","การเปลี่ยนแปลงสภาพภูมิอากาศ","Climate change is the most significant challenge of our time.<br>We need to take action to mitigate climate change.<br>The effects of climate change are visible everywhere.",global warming, climate shift,-,-,intermediate,high
Environment & Sustainability,Contaminate,Verb,"To make something impure or unsuitable by contact with something unclean or poisonous.","ปนเปื้อน","The chemicals contaminated the local water supply.<br>The soil was contaminated with heavy metals.<br>Do not contaminate the clean water.",pollute, taint, spoil,purify, clean,contamination, contaminated,intermediate,high
Environment & Sustainability,Deforestation,Noun,"The action of clearing a wide area of trees.","การตัดไม้ทำลายป่า","Deforestation is a major cause of climate change.<br>The country is fighting against illegal deforestation.<br>We need to stop deforestation to protect animal habitats.",clearing, felling, logging,reforestation, afforestation,deforest, deforested,intermediate,high
Environment & Sustainability,Ecological,Adjective,"Relating to or concerned with the relation of living organisms to one another and to their physical surroundings.","เกี่ยวกับนิเวศวิทยา","The new policy aims to protect the ecological balance of the forest.<br>He has a strong interest in ecological issues.<br>We need to find an ecological solution to the problem.",environmental, biological, symbiotic,-,ecology, ecologist,intermediate,high
Environment & Sustainability,Ecosystem,Noun,"A biological community of interacting organisms and their physical environment.","ระบบนิเวศ","The coral reef is a delicate ecosystem.<br>We need to protect the fragile rainforest ecosystem.<br>The pollution has damaged the entire lake ecosystem.",Environment & Sustainability, habitat, biome,-,-,intermediate,high
Environment & Sustainability,Emission,Noun,"The production and discharge of something, especially gas or radiation.","การปล่อย, ก๊าซเรือนกระจก","The factory's harmful emissions are polluting the air.<br>Countries are working to reduce carbon emissions.<br>Vehicle emission standards have become stricter.",discharge, release, outflow,-,emit, emitted,intermediate,high
Environment & Sustainability,Erosion,Noun,"The process of eroding or being eroded by wind, water, or other natural agents.","การกัดเซาะ","Soil erosion is a serious problem in farming areas.<br>The coastal erosion has damaged many homes.<br>We must find ways to prevent land erosion.",deterioration, wearing away, attrition,formation, buildup,erode, intermediate,high
Environment & Sustainability,Extinct,Adjective,"(of a species, family, or other group of animals or plants) having no living members.","สูญพันธุ์","The dodo bird is an extinct species.<br>We are trying to save several endangered animals from becoming extinct.<br>Many dinosaurs are extinct.",vanished, disappeared, defunct,extant, surviving,extinction, intermediate,high
Environment & Sustainability,Glacier,Noun,"A slowly moving mass or river of ice formed by the accumulation and compaction of snow on mountains or near the poles.","ธารน้ำแข็ง","Glaciers are melting rapidly due to global warming.<br>The expedition explored the ancient glacier.<br>The glacier's retreat is a sign of climate change.",ice sheet, ice mass,-,-,intermediate,high
Environment & Sustainability,Greenhouse effect,Phrase,"The trapping of the sun's warmth in a planet's lower atmosphere.","ปรากฏการณ์เรือนกระจก","The greenhouse effect is causing the planet to warm up.<br>Gases from factories contribute to the greenhouse effect.<br>The greenhouse effect is a natural process that has been accelerated by human activity.",global warming,-,-,-,intermediate,high
Environment & Sustainability,Habitat,Noun,"The natural home or environment of an animal, plant, or other organism.","ถิ่นที่อยู่","The polar bear's natural habitat is the Arctic.<br>Deforestation is destroying the habitat of many animals.<br>The park is a protected habitat for many birds.",home, Environment & Sustainability, territory,-,-,intermediate,high
Environment & Sustainability,Hazardous,Adjective,"Risky; dangerous.","ที่เป็นอันตราย","Hazardous waste must be disposed of properly.<br>The factory was cited for hazardous working conditions.<br>He works with hazardous chemicals.",dangerous, risky, perilous,safe, harmless,hazard, intermediate,high
Environment & Sustainability,Incineration,Noun,"The destruction of something, especially waste material, by burning.","การเผา","Incineration is one way to dispose of waste.<br>The city is building a new waste incineration plant.<br>Incineration can produce energy, but it also creates pollution.",burning, combustion, destruction,-,incinerate, incinerator,advanced,low
Environment & Sustainability,Landfill,Noun,"A large hole in the ground where rubbish is buried.","ที่ฝังกลบขยะ","The city's landfill is almost full.<br>We need to reduce the amount of waste that goes to landfill.<br>Landfills can produce methane gas.",dump, waste site, garbage pit,-,-,intermediate,high
Environment & Sustainability,Mitigation,Noun,"The action of lessening or reducing something.","การบรรเทา","We need to focus on climate change mitigation.<br>The government is providing funds for flood mitigation.<br>Mitigation strategies are essential for disaster management.",alleviation, reduction, lessening,aggravation, intensification,mitigate, intermediate,high
Environment & Sustainability,Natural resource,Phrase,"Materials or substances such as minerals, forests, water, and fertile land that occur in nature and can be used for economic gain.","ทรัพยากรธรรมชาติ","The country is rich in natural resources.<br>The exploitation of natural resources is a major issue.<br>We need to manage our natural resources sustainably.",raw materials, natural assets,-,-,intermediate,high
Environment & Sustainability,Non-renewable,Adjective,"(of a natural resource or source of energy) existing in finite quantity; not capable of being replenished.","ที่ไม่สามารถนำกลับมาใช้ใหม่ได้","Fossil fuels are a major non-renewable resource.<br>We are using up our non-renewable resources too quickly.<br>The country is dependent on non-renewable energy.",exhaustible, finite,-,renewable, replenishable,non-renewal, intermediate,high
Environment & Sustainability,Pollution,Noun,"The presence in or introduction into the environment of a substance or thing that has harmful or poisonous effects.","มลพิษ","Air and water pollution are major health concerns.<br>The government has implemented new laws to combat pollution.<br>Industrial pollution is a global problem.",contamination, impurity, filth,purification, cleanliness,pollute, polluted,intermediate,high
Environment & Sustainability,Recycling,Noun,"The action or process of converting waste into reusable material.","การรีไซเคิล","The city has a new recycling program.<br>Recycling helps reduce waste and conserve resources.<br>The company is committed to recycling all its waste.",reprocessing, reuse, salvaging,-,recycle, recycled,intermediate,high
Environment & Sustainability,Reforestation,Noun,"The replanting of forests.","การปลูกป่า","The organization is working on a massive reforestation project.<br>Reforestation is one of the best ways to combat climate change.<br>The government is offering incentives for reforestation.",replanting, afforestation, forestation,deforestation, intermediate,medium
Environment & Sustainability,Renewable,Adjective,"(of a natural resource or source of energy) not depleted when used.","ที่สามารถนำกลับมาใช้ใหม่ได้","Solar and wind power are forms of renewable energy.<br>The country is investing heavily in renewable resources.<br>Using renewable materials is good for the planet.",sustainable, replenishable, inexhaustible,non-renewable, exhaustible,renew, renewal,intermediate,high
Environment & Sustainability,Smog,Noun,"A kind of air pollution caused by a mixture of smoke and fog.","หมอกควันพิษ","The city is often covered in thick smog.<br>Smog is a major health problem in urban areas.<br>The factory contributes to the smog in the region.",haze, pollution, atmospheric pollution,-,-,intermediate,high
Environment & Sustainability,Sustainable,Adjective,"Able to be maintained at a certain rate or level.","ที่ยั่งยืน","The company is committed to sustainable development.<br>We need to find sustainable solutions to our problems.<br>Sustainable agriculture is key for the future.",viable, enduring, lasting,unsustainable, temporary,sustainability, intermediate,high
Environment & Sustainability,Toxic,Adjective,"Poisonous.","เป็นพิษ","The factory released toxic chemicals into the river.<br>The waste is highly toxic and dangerous.<br>You need to handle these toxic substances with care.",poisonous, venomous, harmful,non-toxic, harmless,toxicity, intermediate,high
Environment & Sustainability,Vulnerable,Adjective,"Exposed to the possibility of being attacked or harmed, either physically or emotionally.","เปราะบาง, เสี่ยง","Endangered species are highly vulnerable to habitat loss.<br>The coast is vulnerable to erosion.<br>Children are often the most vulnerable members of society.",susceptible, defenseless, exposed,invulnerable, protected,vulnerability, intermediate,high
Environment & Sustainability,Waste management,Phrase,"The collection, transport, and disposal of garbage.","การจัดการขยะ","Effective waste management is crucial for a clean city.<br>The company has a new waste management system.<br>Proper waste management helps protect the environment.",refuse disposal, garbage control,-,-,intermediate,high
Environment & Sustainability,Wind power,Phrase,"Power generated by converting the force of the wind into energy.","พลังงานลม","Wind power is a clean alternative to fossil fuels.<br>The country has many wind power farms.<br>Wind power is becoming more efficient.",wind energy,-,-,-,intermediate,high
Environment & Sustainability,Biodiversity,Noun,"The variety of plant and animal life in the world or in a particular habitat.","ความหลากหลายทางชีวภาพ","The rainforest is known for its rich biodiversity.<br>Protecting biodiversity is crucial for a healthy ecosystem.<br>We need to conserve biodiversity for future generations.",biological diversity,-,biodiverse,advanced,high
Environment & Sustainability,Conservation,Noun,"The act of preserving or protecting something from harm or destruction.","การอนุรักษ์","Wildlife conservation is a major global effort.<br>Energy conservation helps reduce our carbon footprint.<br>The government has a strong focus on natural resource conservation.",preservation, protection, safeguarding,destruction, neglect,conserve, conservative,intermediate,high
Environment & Sustainability,Deforestation,Noun,"The action of clearing a wide area of trees.","การตัดไม้ทำลายป่า","Deforestation is a major cause of climate change.<br>The country is fighting against illegal deforestation.<br>We need to stop deforestation to protect animal habitats.",clearing, felling, logging,reforestation, afforestation,deforest, deforested,intermediate,high
Environment & Sustainability,Emission,Noun,"The production and discharge of something, especially gas or radiation.","การปล่อย, ก๊าซเรือนกระจก","The factory's harmful emissions are polluting the air.<br>Countries are working to reduce carbon emissions.<br>Vehicle emission standards have become stricter.",discharge, release, outflow,-,emit, emitted,intermediate,high
Environment & Sustainability,Erosion,Noun,"The process of eroding or being eroded by wind, water, or other natural agents.","การกัดเซาะ","Soil erosion is a serious problem in farming areas.<br>The coastal erosion has damaged many homes.<br>We must find ways to prevent land erosion.",deterioration, wearing away, attrition,formation, buildup,erode, intermediate,high
Environment & Sustainability,Extinct,Adjective,"(of a species, family, or other group of animals or plants) having no living members.","สูญพันธุ์","The dodo bird is an extinct species.<br>We are trying to save several endangered animals from becoming extinct.<br>Many dinosaurs are extinct.",vanished, disappeared, defunct,extant, surviving,extinction, intermediate,high
Environment & Sustainability,Habitat,Noun,"The natural home or environment of an animal, plant, or other organism.","ถิ่นที่อยู่","The polar bear's natural habitat is the Arctic.<br>Deforestation is destroying the habitat of many animals.<br>The park is a protected habitat for many birds.",home, Environment & Sustainability, territory,-,-,intermediate,high
Environment & Sustainability,Pollution,Noun,"The presence in or introduction into the environment of a substance or thing that has harmful or poisonous effects.","มลพิษ","Air and water pollution are major health concerns.<br>The government has implemented new laws to combat pollution.<br>Industrial pollution is a global problem.",contamination, impurity, filth,purification, cleanliness,pollute, polluted,intermediate,high
Environment & Sustainability,Renewable,Adjective,"(of a natural resource or source of energy) not depleted when used.","ที่สามารถนำกลับมาใช้ใหม่ได้","Solar and wind power are forms of renewable energy.<br>The country is investing heavily in renewable resources.<br>Using renewable materials is good for the planet.",sustainable, replenishable, inexhaustible,non-renewable, exhaustible,renew, renewal,intermediate,high
Environment & Sustainability,Sustainable,Adjective,"Able to be maintained at a certain rate or level.","ที่ยั่งยืน","The company is committed to sustainable development.<br>We need to find sustainable solutions to our problems.<br>Sustainable agriculture is key for the future.",viable, enduring, lasting,unsustainable, temporary,sustainability, intermediate,high
Environment & Sustainability,Biodegradable,Adjective,"(of a substance or object) capable of being decomposed by bacteria or other living organisms.","ที่ย่อยสลายได้ทางชีวภาพ","We should use biodegradable bags instead of plastic ones.<br>The material is completely biodegradable.<br>Biodegradable waste can be used for compost.",compostable, decomposable,-,non-biodegradable,biodegradability, advanced,medium
Environment & Sustainability,Carbon footprint,Phrase,"The amount of carbon dioxide released into the atmosphere as a result of the activities of a particular individual, organization, or community.","ปริมาณคาร์บอนฟุตพรินท์","You can reduce your carbon footprint by walking or cycling.<br>The company is trying to reduce its carbon footprint.<br>Flying has a large carbon footprint.",CO2 emissions,-,-,carbon, intermediate,high
Environment & Sustainability,Climate change,Phrase,"A change in global or regional climate patterns.","การเปลี่ยนแปลงสภาพภูมิอากาศ","Climate change is the most significant challenge of our time.<br>We need to take action to mitigate climate change.<br>The effects of climate change are visible everywhere.",global warming, climate shift,-,-,intermediate,high
Environment & Sustainability,Ecological,Adjective,"Relating to or concerned with the relation of living organisms to one another and to their physical surroundings.","เกี่ยวกับนิเวศวิทยา","The new policy aims to protect the ecological balance of the forest.<br>He has a strong interest in ecological issues.<br>We need to find an ecological solution to the problem.",environmental, biological, symbiotic,-,ecology, ecologist,intermediate,high
Environment & Sustainability,Ecosystem,Noun,"A biological community of interacting organisms and their physical environment.","ระบบนิเวศ","The coral reef is a delicate ecosystem.<br>We need to protect the fragile rainforest ecosystem.<br>The pollution has damaged the entire lake ecosystem.",Environment & Sustainability, habitat, biome,-,-,intermediate,high
